<?xml version='1.0'?>

<!--
 * This code is sample code, provided as-is, and we make no
 * warranties as to its correctness or suitablity for
 * any purpose.
 *
 * We hope that it's useful to you.  Enjoy.
 * Copyright 2004-10 LearningPatterns Inc.
-->

<!--
Comment out this PI to see the full document in a browser.
If the PI is left in, you should see the customer info in a table.
-->
<!-- ?xml-stylesheet type='text/xsl' href='file:///StudentWork/XML/customer.xsl'? -->

<!-- JavaTunes order XML document -->

<order xmlns:xsi='http://www.w3.org/2001/XMLSchema-instance'
       xsi:noNamespaceSchemaLocation='order.xsd'
       ID='_12050826' dateTime='2002-02-07T16:20:00'>
  <customer>
    <name>James Heft</name>
    <street>455 Meadow St.</street>
    <city>Lodi</city>
    <state>CA</state>
    <zipcode>95112</zipcode>
    <shipper name='UPS' accountNum='544-8775-1'/>
    <?pager UPS 544-8775-1?>
  </customer>
  <item ID='CD513'>
    <name>My, I'm Large</name>
    <artist>Bobs</artist>
    <releaseDate>1987-02-20</releaseDate>
    <listPrice>11.97</listPrice>
    <price>11.97</price>
  </item>
  <item ID='CD518'>
    <name>Escape</name>
    <artist>Journey</artist>
    <artist>Seals &amp; Crofts</artist>
    <releaseDate>1981-02-25</releaseDate>
    <listPrice>11.97</listPrice>
    <price/>  <!-- take the default value -->
  </item>
</order>
